"Diseases","Symptoms","Features","Suggestions","Description","","","","","","","","","","","","","","","","","","","","","","Disease","Common Suggestions"
"Autism","Repetitive behaviors ","behaviors ","Encourage social interaction","Engage in social activities, such as group activities or spending time with friends or family, to provide a change in environment.","","","","","","","","","","","","","","","","","","","","","","",""
"Autism","Repetitive behaviors ","behaviors ","Utilize technology","Use technology, such as timers or reminders, to help stay more aware of when the repetitive behavior is happening and interrupt the pattern.","","","","","","","","","","","","","","","","","","","","","","",""
"Autism","Repetitive behaviors ","behaviors ","Practice mindfullness","Mindfulness exercises such as meditation or deep breathing can help the individual become more aware of their repetitive behavior and recognize when it is happening.","","","","","","","","","","","","","","","","","","","","","","",""
"Autism","Get upset by minor changes","upset","Stay positive","Focus on the positive aspects of the change rather than dwelling on the negative","","","","","","","","","","","","","","","","","","","","","","",""
"Autism","Get upset by minor changes","upset","Be flexible","Adapt to the change and be willing to adjust your plans and expectations","","","","","","","","","","","","","","","","","","","","","","",""
"Autism","Get upset by minor changes","upset","Embrace uncertainity","Realize that change is a natural part of life, and be open to the opportunities that it presents","","","","","","","","","","","","","","","","","","","","","","",""
"Autism","Get upset by minor changes","upset","Keep things in perspective ","Try to see the bigger picture and understand the impact of the minor change in the grand scheme of things.","","","","","","","","","","","","","","","","","","","","","","",""
"Autism","Has obesessive interests","obesessive","Diversify your interests","Try to engage yourself in different activities like sports, music, reading, travelling, etc. This will help you develop a range of passions and reduce the risk of becoming obsessive about a single activity","","","","","","","","","","","","","","","","","","","","","","",""
"Obesity","High cholestrol level","cholestrol level","Eat a healthy diet","Eating a diet that is low in saturated and trans fats and high in fruits, vegetables, whole grains, and lean protein can help lower cholesterol levels","","","","","","","","","","","","","","","","","","","","","","Obesity","Regular exercise: Regular exercise is crucial for managing obesity. Aim for at least 150 minutes of moderate-intensity aerobic exercise per week, such as brisk walking or cycling, and incorporate strength training exercises to build muscle."
"Obesity","High cholestrol level","cholestrol level","Quit smoking","Smoking can increase cholesterol levels and contribute to the development of heart disease. Quitting smoking can help lower cholesterol levels and improve overall health","","","","","","","","","","","","","","","","","","","","","","Obesity","Healthy diet: Eating a healthy, balanced diet is essential for managing obesity. Focus on consuming whole, nutrient-dense foods, such as fruits, vegetables, lean protein, and whole grains, while limiting processed and high-calorie foods."
"Obesity","High cholestrol level","cholestrol level","Maintain a healthy weight","Being overweight or obese can increase cholesterol levels. Losing weight through a healthy diet and regular exercise can help lower cholesterol levels","","","","","","","","","","","","","","","","","","","","","","Obesity","Do not skip breakfast. Skipping breakfast will not help you lose weight."
"Obesity","High blood pressure","pressure","Reduce stress","Stress can temporarily increase blood pressure. Finding ways to manage stress, such as through meditation, yoga, or deep breathing, can help lower blood pressure","","","","","","","","","","","","","","","","","","","","","","Obesity","Eat high fibre foods."
"Obesity","High blood pressure","blood pressure","Avoid listening shocking news","Listening to shocking matters can cause in increasing blood presssure","","","","","","","","","","","","","","","","","","","","","","",""
"Obesity","Sleep apnea","apnea","Dental appliances","Dental appliances can be custom-fitted by a dentist to help keep the airway open during sleep","","","","","","","","","","","","","","","","","","","","","","",""
"Obesity","Sleep apnea","apnea","Continuous Positive Airway Pressure therapy","CPAP therapy involves wearing a mask over the nose and/or mouth during sleep. The mask is connected to a machine that delivers a continuous stream of air to keep the airway open","","","","","","","","","","","","","","","","","","","","","","",""
"Obesity","Sleep apnea","apnea","Weight loss","Losing weight can help reduce the severity of sleep apnea, especially for people who are overweight or obese","","","","","","","","","","","","","","","","","","","","","","",""
"Obesity","Sleep apnea","apnea","Avoid alcohol and sedatives","Alcohol and sedatives can relax the muscles in the airway, making it more likely to collapse during sleep. Avoiding alcohol and sedatives before bedtime can help improve sleep apnea symptoms","","","","","","","","","","","","","","","","","","","","","","",""
"Obesity","Sleep apnea","sleep","Sleeping on your side","Sleeping on your side can help keep the airway open and reduce the severity of sleep apnea","","","","","","","","","","","","","","","","","","","","","","",""
"Obesity","Joint pain","Joint pain","Heat and cold therapy","Applying heat or cold to the affected joint can help alleviate pain and reduce inflammation. A warm shower or heating pad can help relax muscles and ease pain, while a cold pack can help reduce inflammation","","","","","","","","","","","","","","","","","","","","","","",""
"Obesity","Increase in body weight","weight","Drink plenty of water","Drinking water can help you feel full and hydrated, and may help reduce calorie intake","","","","","","","","","","","","","","","","","","","","","","",""
"Obesity","Increase in body weight","Increase","Get enough sleep","Getting adequate sleep can help regulate hormones that affect appetite and metabolism, and may help aid in weight loss","","","","","","","","","","","","","","","","","","","","","","",""
"Obesity","Increase in body weight","body weight","Reduce portion size","Eating smaller portions can help reduce calorie intake and aid in weight loss. Use smaller plates or bowls, and measure out portion sizes to help control the amount you eat","","","","","","","","","","","","","","","","","","","","","","",""
"Flu","Fever usually high","high","Take a luke warm bath","Taking a bath in lukewarm water can help reduce fever by promoting sweating and cooling the body","","","","","","","","","","","","","","","","","","","","","","Flu","Wash your hands well and often."
"Flu","Fever usually high","high","Stay hydrated","Drinking plenty of fluids, such as water, juice, or broth, can help prevent dehydration and regulate body temperature","","","","","","","","","","","","","","","","","","","","","","","Cough or sneeze into a tissue or your elbow — not into your hands."
"Flu","Fever usually high","high","Wear light clothing","Dressing in lightweight, breathable clothing can help regulate body temperature and promote sweating, which can help reduce fever","","","","","","","","","","","","","","","","","","","","","","","Rest: Rest is essential for recovery from the flu. Stay at home and avoid physical activity until symptoms improve."
"Flu","Fever usually high","usually high","Apply a cool compress","Placing a cool, damp washcloth on the forehead, neck, or wrists can help reduce body temperature","","","","","","","","","","","","","","","","","","","","","","",""
"Flu","Cough","Cough","Gargle with salt water","Gargling with warm salt water can help soothe the throat and reduce cough","","","","","","","","","","","","","","","","","","","","","","",""
"Flu","Cough","Cough","Use a humidifier","Adding moisture to the air can help soothe the throat and reduce cough. Use a humidifier or take a hot shower to add moisture to the ai","","","","","","","","","","","","","","","","","","","","","","",""
"Flu","Cough","Cough","Stay hydrated","Drinking plenty of fluids, such as water, warm tea, or broth, can help keep the throat moist and reduce cough","","","","","","","","","","","","","","","","","","","","","","",""
"Flu","Soar throat","throat","Use throat lozenges and sprays","Sucking on throat lozenges or using throat sprays can help alleviate a sore throat by numbing the throat and reducing inflammation","","","","","","","","","","","","","","","","","","","","","","",""
"Flu","Soar throat","Soar throat","Drink warm fluids","Drinking warm liquids, such as tea or broth, can help soothe the throat and provide temporary relief","","","","","","","","","","","","","","","","","","","","","","",""
"Flu","Runny or stuffy nose","stuffy nose","Use saline nasal drops","Saline nasal drops or spray can help flush out the nasal passages and alleviate congestion","","","","","","","","","","","","","","","","","","","","","","",""
"Flu","Runny or stuffy nose","Runny","Avoid irritants","Avoid exposure to irritants, such as smoke or chemicals, which can irritate the nasal passages and make symptoms worse","","","","","","","","","","","","","","","","","","","","","","",""
"Flu","Body aches","Body aches","Stretch","Gentle stretching or yoga can help relieve muscle tension and reduce body aches","","","","","","","","","","","","","","","","","","","","","","",""
"Flu","Body aches","Body aches","Massage","A gentle massage can help relieve muscle tension and reduce body aches.","","","","","","","","","","","","","","","","","","","","","","",""
"Flu","Body aches","Body aches","Apply heat or cold","Applying heat or cold to the affected area can help alleviate pain and reduce inflammation. Use a hot compress, such as a heating pad or warm towel, for muscle aches, or a cold compress, such as an ice pack or frozen vegetables wrapped in a towel, for joint pain","","","","","","","","","","","","","","","","","","","","","","",""
